{
  "schema_version": "1.0.0",
  "id": "lpic1.104.5.lesson.permissions-special-bits",
  "title_fr": "Permissions, ownership et bits spéciaux",
  "objective_ids": [
    "104.5"
  ],
  "concept_ids": [
    "lpic1.104.5.permissions-rwx-fichier-dossier",
    "lpic1.104.5.notation-symbolique-octale",
    "lpic1.104.5.proprietaire-groupe",
    "lpic1.104.5.umask",
    "lpic1.104.5.suid",
    "lpic1.104.5.sgid",
    "lpic1.104.5.sticky-bit",
    "lpic1.104.5.effets-speciaux-sur-repertoires"
  ],
  "stage": "deepen",
  "estimated_minutes": 11,
  "body_markdown": "# Permissions, ownership et bits spéciaux\n\nLe modèle Unix classique associe à chaque inode un propriétaire, un groupe et trois triplets de permissions : user, group et other. Les mêmes lettres `rwx` n'ont pas exactement le même effet sur un fichier et sur un répertoire.\n\n## rwx sur fichiers et répertoires\n\nSur un fichier, `r` permet de lire son contenu, `w` de le modifier et `x` de l'exécuter lorsque le format s'y prête. Sur un répertoire, `r` permet de lire la liste de noms, `x` permet de traverser le répertoire et d'accéder à une entrée connue, et `w` permet de modifier les entrées du répertoire. Supprimer un fichier dépend donc principalement des droits sur son répertoire parent, pas du bit `w` du fichier lui-même.\n\n## Notation symbolique et octale\n\n`chmod u+rwx,g+rx,o-rwx fichier` exprime les changements symboliquement. En octal, `r=4`, `w=2`, `x=1`; on additionne les bits pour chaque classe. Ainsi `rwxr-x---` vaut `750`. Les bits spéciaux occupent un chiffre supplémentaire : SUID=4000, SGID=2000, sticky=1000.\n\n## Propriétaire et groupe\n\n`chown utilisateur:groupe chemin` peut changer propriétaire et groupe, tandis que `chgrp groupe chemin` ne change que le groupe. Les changements possibles dépendent des privilèges du processus. Le groupe associé à un fichier participe au calcul des permissions lorsqu'il correspond aux groupes du processus.\n\n## umask\n\n`umask` retire des bits lors de la création. Les permissions de base sont généralement `666` pour un fichier ordinaire et `777` pour un répertoire, puis le masque désactive certains bits. Avec `umask 027`, un fichier demandé en 666 devient 640 et un répertoire demandé en 777 devient 750. Ce n'est pas une soustraction décimale mais une opération de masquage de bits.\n\n## SUID\n\nSur un exécutable binaire, SUID demande que le processus utilise comme effective UID le propriétaire du fichier lors de l'exécution. Cela peut permettre une opération privilégiée très ciblée mais augmente fortement l'impact d'une vulnérabilité. Sous Linux, les scripts interprétés ne doivent pas être considérés comme un moyen fiable d'obtenir ce comportement.\n\n## SGID\n\nSur un exécutable, SGID agit de façon analogue sur l'effective GID. Sur un répertoire, son usage le plus important est différent : les nouvelles entrées héritent du groupe du répertoire plutôt que de dépendre uniquement du groupe primaire du créateur. C'est utile pour les espaces collaboratifs.\n\n## Sticky bit\n\nSur un répertoire inscriptible par plusieurs utilisateurs, le sticky bit limite la suppression ou le renommage d'une entrée : un utilisateur ordinaire ne peut pas supprimer librement le fichier d'un autre simplement parce qu'il peut écrire dans le répertoire. `/tmp` est l'exemple classique.\n\n## Combiner les effets sur un répertoire partagé\n\nSGID et sticky répondent donc à deux problèmes distincts : SGID stabilise le groupe des nouvelles entrées ; sticky restreint qui peut supprimer/renommer les entrées. Un mode comme `3770` combine SGID (2000), sticky (1000) et `770`. `ls -l` rend les bits spéciaux visibles avec `s/S` ou `t/T` selon la présence du bit d'exécution associé.\n\nPour analyser un problème d'accès, inspecte le chemin complet, le propriétaire/groupe, les groupes du processus, les permissions de chaque répertoire traversé, le umask de création et les éventuels bits spéciaux.",
  "labels": [
    "lpic-required",
    "modern-practice"
  ],
  "distribution": "generic"
}
