{
  "schema_version": "1.0.0",
  "id": "lpic1.103.1.lesson.command-line-foundations",
  "title_fr": "Fondamentaux du travail en ligne de commande",
  "objective_ids": [
    "103.1"
  ],
  "concept_ids": [
    "lpic1.103.1.syntaxe-shell-et-sequences-de-commandes",
    "lpic1.103.1.variables-shell-environnement",
    "lpic1.103.1.path-et-resolution-de-commande",
    "lpic1.103.1.quoting-escaping",
    "lpic1.103.1.historique",
    "lpic1.103.1.documentation-et-identification-d-une-commande",
    "lpic1.103.1.informations-systeme-de-base"
  ],
  "stage": "deepen",
  "estimated_minutes": 9,
  "body_markdown": "# Ligne de commande : repères essentiels\n\n- `;`, `&&` et `||` enchaînent des commandes selon leur statut de sortie. `$?` contient le dernier statut.\n- `NAME=value` crée une variable shell. `export NAME` la transmet aux processus enfants ; `env` montre l'environnement ; `unset` la supprime.\n- `PATH` détermine où le shell cherche les exécutables. `command -v` et `type` montrent ce qui sera réellement lancé.\n- Les quotes simples gardent le texte littéral. Les doubles quotes autorisent les expansions tout en conservant les espaces dans un seul argument.\n- `history` montre l'historique du shell courant ; `~/.bash_history` n'est pas forcément synchronisé immédiatement.\n- `man`, `--help` et `help` servent à documenter commandes et builtins.\n- `uname`, `uptime` et `pwd` donnent rapidement le contexte de la machine.\n\nEn diagnostic, commence par observer la résolution de commande, l'environnement et les arguments avant de modifier la configuration.",
  "labels": [
    "lpic-required",
    "modern-practice"
  ],
  "distribution": "generic"
}
