{
  "schema_version": "1.0.0",
  "id": "lpic1.103.4.lesson.redirection-order",
  "title_fr": "L'ordre des redirections change le résultat",
  "objective_ids": [
    "103.4"
  ],
  "concept_ids": [
    "lpic1.103.4.ordre-des-redirections"
  ],
  "stage": "deepen",
  "estimated_minutes": 4,
  "body_markdown": "Bash applique les redirections de gauche à droite. Dans `commande > tout.log 2>&1`, `stdout` pointe d'abord vers `tout.log`, puis `stderr` est dupliqué vers la destination actuelle de `stdout` : les deux flux vont dans le fichier.\n\nDans `commande 2>&1 > sortie.log`, `stderr` est d'abord dupliqué vers l'ancien `stdout` du terminal, puis seul `stdout` est redirigé vers le fichier. Les deux lignes contiennent les mêmes opérateurs mais ne sont donc pas équivalentes.",
  "labels": [
    "lpic-required"
  ],
  "distribution": "generic"
}
